{
  "version": "1.0",
  "id": "preset-pyramid",
  "name": "金字塔",
  "description": "3 层金字塔，14 块",
  "type": "unitCubeArray",
  "source": "builtin",
  "tags": ["三视图", "多层", "对称"],
  "positions": [
    [1,0,1],[2,0,1],[3,0,1],[1,0,2],[2,0,2],[3,0,2],[1,0,3],[2,0,3],[3,0,3],
    [1,1,1],[2,1,1],[1,1,2],[2,1,2],
    [2,2,2]
  ],
  "appearance": {
    "colorScheme": "layered",
    "opacity": 1.0,
    "wireframeColor": "#5c4033",
    "layerPalette": ["#6baed6", "#fd8d3c", "#74c476", "#9e9ac8"]
  },
  "grid": { "size": 5, "origin": [0, 0, 0] }
}
